{
  "schemaVersion": "artifact-catalog/v1",
  "id": "event-portal.catalog.monolith",
  "version": "1.0.0",
  "derivation": { "builderAdapter": "node-modular-monolith-v1", "testAdapter": "node-test-v1" },
  "artifacts": [
    { "schemaVersion": "artifact/v1", "id": "event-portal.monolith.runtime.server", "kind": "source-bundle", "version": "1.0.0", "source": { "provider": "local", "location": "event-portal-assets", "path": "modular-monolith/runtime/server.ts" }, "integrity": { "algorithm": "sha256", "digest": "sha256:d2676fecf86b8fcf6d749b3890a5ef7fb9ccb3da74817f2a08e40ff6488206e0" }, "build": { "adapter": "node-source-v1", "entrypoint": "src/runtime/server.ts" }, "requiresCapabilities": ["node-runtime"] },
    { "schemaVersion": "artifact/v1", "id": "event-portal.monolith.runtime.types", "kind": "source-bundle", "version": "1.0.0", "source": { "provider": "local", "location": "event-portal-assets", "path": "modular-monolith/runtime/types.ts" }, "integrity": { "algorithm": "sha256", "digest": "sha256:4cdb3e43c09d7ca947e9b375004dbe01e020e4a58152c79725eed6d0685e2148" }, "build": { "adapter": "node-source-v1", "entrypoint": "src/runtime/types.ts" }, "requiresCapabilities": ["node-runtime"] },
    { "schemaVersion": "artifact/v1", "id": "event-portal.monolith.agenda", "kind": "module", "version": "1.0.0", "source": { "provider": "local", "location": "event-portal-assets", "path": "modular-monolith/features/agenda/module.ts" }, "integrity": { "algorithm": "sha256", "digest": "sha256:47adae23f03b78c2c0b84ffd8f5a2f326226fae368ad58d4d9b21f0d8b20b1da" }, "build": { "adapter": "node-module-v1", "entrypoint": "src/features/agenda/module.ts" }, "requiresCapabilities": ["node-runtime"] },
    { "schemaVersion": "artifact/v1", "id": "event-portal.monolith.registration.ui", "kind": "module", "version": "1.0.0", "source": { "provider": "local", "location": "event-portal-assets", "path": "modular-monolith/features/registration/ui.ts" }, "integrity": { "algorithm": "sha256", "digest": "sha256:25cab5a3bb9f13c5984eb4d7a9d8012920aeda8812573c7d71646daa7e1af632" }, "build": { "adapter": "node-module-v1", "entrypoint": "src/features/registration/ui.ts" }, "requiresCapabilities": ["node-runtime"] },
    { "schemaVersion": "artifact/v1", "id": "event-portal.monolith.registration.api", "kind": "module", "version": "1.0.0", "source": { "provider": "local", "location": "event-portal-assets", "path": "modular-monolith/features/registration/api.ts" }, "integrity": { "algorithm": "sha256", "digest": "sha256:6df4d99576f42641856a9b3c710aed439f688736c24be1d9cb5d5bbff0ae7509" }, "build": { "adapter": "node-module-v1", "entrypoint": "src/features/registration/api.ts" }, "requiresCapabilities": ["node-runtime"] },
    { "schemaVersion": "artifact/v1", "id": "event-portal.monolith.registration.schema", "kind": "configuration", "version": "1.0.0", "source": { "provider": "local", "location": "event-portal-assets", "path": "modular-monolith/features/registration/schema.json" }, "integrity": { "algorithm": "sha256", "digest": "sha256:f89f12be9a769592f822f64862477ea43dd6bbf1af464a1eec8dba4b05b7fa26" }, "build": { "adapter": "node-configuration-v1", "entrypoint": "src/features/registration/schema.json" }, "requiresCapabilities": ["node-runtime"] },
    { "schemaVersion": "artifact/v1", "id": "event-portal.monolith.registration.tests", "kind": "test-suite", "version": "1.0.0", "source": { "provider": "local", "location": "event-portal-assets", "path": "modular-monolith/features/registration/registration.test.ts" }, "integrity": { "algorithm": "sha256", "digest": "sha256:e897a7bfc337462f76c9dc017e857e551cbcf953ea02ef18eab8ef8f93f2946b" }, "build": { "adapter": "node-test-v1", "entrypoint": "src/features/registration/registration.test.ts" }, "requiresCapabilities": ["node-runtime"] },
    { "schemaVersion": "artifact/v1", "id": "event-portal.monolith.notifications", "kind": "module", "version": "1.0.0", "source": { "provider": "local", "location": "event-portal-assets", "path": "modular-monolith/features/notifications/module.ts" }, "integrity": { "algorithm": "sha256", "digest": "sha256:acd5cca2a86f7c0bd1e75530f19d296c7058f55e742c206cd7a457fdab9a07b2" }, "build": { "adapter": "node-module-v1", "entrypoint": "src/features/notifications/module.ts" }, "requiresCapabilities": ["node-runtime"] },
    { "schemaVersion": "artifact/v1", "id": "event-portal.monolith.presential", "kind": "module", "version": "1.0.0", "source": { "provider": "local", "location": "event-portal-assets", "path": "modular-monolith/features/presential/module.ts" }, "integrity": { "algorithm": "sha256", "digest": "sha256:f2038b78d4695c6c366bbb32b91722d00cdaecef4559b186840986ed98020457" }, "build": { "adapter": "node-module-v1", "entrypoint": "src/features/presential/module.ts" }, "requiresCapabilities": ["node-runtime"] },
    { "schemaVersion": "artifact/v1", "id": "event-portal.monolith.virtual", "kind": "module", "version": "1.0.0", "source": { "provider": "local", "location": "event-portal-assets", "path": "modular-monolith/features/virtual/module.ts" }, "integrity": { "algorithm": "sha256", "digest": "sha256:4f4deee161648b5d509bf86a9c2362886983ca898f7cfab35b416a44c4555ccd" }, "build": { "adapter": "node-module-v1", "entrypoint": "src/features/virtual/module.ts" }, "requiresCapabilities": ["node-runtime"] },
    { "schemaVersion": "artifact/v1", "id": "event-portal.monolith.venue-map", "kind": "module", "version": "1.0.0", "source": { "provider": "local", "location": "event-portal-assets", "path": "modular-monolith/features/venue-map/module.ts" }, "integrity": { "algorithm": "sha256", "digest": "sha256:2cf9d1c403f67004d51d8f18e7ed566eff3c1ca0c8a952b2ad1b4318ee712e2f" }, "build": { "adapter": "node-module-v1", "entrypoint": "src/features/venue-map/module.ts" }, "requiresCapabilities": ["node-runtime"] }
  ]
}
