{
  "schemaVersion": "artifact-catalog/v1",
  "id": "event-portal.catalog.static",
  "version": "1.0.0",
  "derivation": { "builderAdapter": "static-site-v1", "testAdapter": "html-validation-v1" },
  "artifacts": [
    { "schemaVersion": "artifact/v1", "id": "event-portal.static.shell", "kind": "html-fragment", "version": "1.0.0", "source": { "provider": "local", "location": "event-portal-assets", "path": "static/portal-shell.html" }, "integrity": { "algorithm": "sha256", "digest": "sha256:1e6548ad2e55e442e18f6c4a87fddd22f367221cc79508f31e9932f81e50a04c" }, "build": { "adapter": "static-fragment-v1", "entrypoint": null }, "requiresCapabilities": ["static-http"] },
    { "schemaVersion": "artifact/v1", "id": "event-portal.static.agenda", "kind": "html-fragment", "version": "1.0.0", "source": { "provider": "local", "location": "event-portal-assets", "path": "static/agenda.html" }, "integrity": { "algorithm": "sha256", "digest": "sha256:591ab7dccf55bc1b3024abd6582a59ea227294032a4243d929c0969c50a1c9c5" }, "build": { "adapter": "static-fragment-v1", "entrypoint": null }, "requiresCapabilities": ["static-http"] },
    { "schemaVersion": "artifact/v1", "id": "event-portal.static.registration", "kind": "html-fragment", "version": "1.0.0", "source": { "provider": "local", "location": "event-portal-assets", "path": "static/registration.html" }, "integrity": { "algorithm": "sha256", "digest": "sha256:553462db290af36c7fe97f366f7528159d80beac77196ee53461ab4d1ec44380" }, "build": { "adapter": "static-fragment-v1", "entrypoint": null }, "requiresCapabilities": ["static-http"] },
    { "schemaVersion": "artifact/v1", "id": "event-portal.static.notifications", "kind": "html-fragment", "version": "1.0.0", "source": { "provider": "local", "location": "event-portal-assets", "path": "static/notifications.html" }, "integrity": { "algorithm": "sha256", "digest": "sha256:52af7007d7b3da394790453e02103b1d3f11d19ebd30fd34cfe850b256b9532f" }, "build": { "adapter": "static-fragment-v1", "entrypoint": null }, "requiresCapabilities": ["static-http"] },
    { "schemaVersion": "artifact/v1", "id": "event-portal.static.presential", "kind": "html-fragment", "version": "1.0.0", "source": { "provider": "local", "location": "event-portal-assets", "path": "static/presential.html" }, "integrity": { "algorithm": "sha256", "digest": "sha256:5bd07ec28d5ba8a0e2f15714ed54d32bc9194c6a8b4e83a0e64c58ce8f4648d8" }, "build": { "adapter": "static-fragment-v1", "entrypoint": null }, "requiresCapabilities": ["static-http"] },
    { "schemaVersion": "artifact/v1", "id": "event-portal.static.virtual", "kind": "html-fragment", "version": "1.0.0", "source": { "provider": "local", "location": "event-portal-assets", "path": "static/virtual.html" }, "integrity": { "algorithm": "sha256", "digest": "sha256:d6d761d098f9f6d2154134d43e26f797520012b274bd68cdaeb06664ebdfe26e" }, "build": { "adapter": "static-fragment-v1", "entrypoint": null }, "requiresCapabilities": ["static-http"] },
    { "schemaVersion": "artifact/v1", "id": "event-portal.static.venue-map", "kind": "html-fragment", "version": "1.0.0", "source": { "provider": "local", "location": "event-portal-assets", "path": "static/venue-map.html" }, "integrity": { "algorithm": "sha256", "digest": "sha256:d82c98f6044f378c91c5ca4a820a7db42b84ead179c513ba4cd5186fb64ca763" }, "build": { "adapter": "static-fragment-v1", "entrypoint": null }, "requiresCapabilities": ["static-http"] },
    { "schemaVersion": "artifact/v1", "id": "event-portal.static.welcome-message", "kind": "html-fragment", "version": "1.0.0", "source": { "provider": "local", "location": "event-portal-assets", "path": "static/welcome-message.html" }, "integrity": { "algorithm": "sha256", "digest": "sha256:700f0f128771ebfe85318330f19baec40c3a492ef1742d0e0e6e4f4529d73cb2" }, "build": { "adapter": "static-fragment-v1", "entrypoint": null }, "requiresCapabilities": ["static-http"] }
  ]
}
